Source,Subtopic1,Subtopic2,WordType,Swedish,SwedishExample,en_Word,en_Example,es_Word,es_Example,fa_Word,fa_Example,el_Word,el_Example,uk_Word,uk_Example,ru_Word,ru_Example,hi_Word,hi_Example,bn_Word,bn_Example,sq_Word,sq_Example,tr_Word,tr_Example,ms_Word,ms_Example,fil_Word,fil_Example,Present,PresentTranslation,PresentExample,PresentExampleTranslation,Preteritum,PreteritumTranslation,PreteritumExample,PreteritumExampleTranslation,Supinium,SupiniumTranslation,SupiniumExample,SupiniumExampleTranslation,ID,SwedishExampleNote,PresentExampleNote,PreteritumExampleNote,SupiniumExampleNote
Kelly List,A1,101 to 200,Verb,Att Tycka,Det är svårt att tycka om alla.,"think, believe, consider",It is difficult to like everyone.,,,,,,,,,,,,,,,,,,,,,,,tycker,"thinks, believes, feels ",Jag tycker det är bra.,I think it is good.,tyckte," thought, believed, felt ",Hon tyckte det var dyrt.,She thought it was expensive.,tyckt," thought, believed, felt",Vi har tyckt det länge.,We have thought that for a long time.,297
Kelly List,A1,101 to 200,Verb,Att Vända,Det är dags att vända pannkakan.,"turn, rotate, flip",It is time to flip the pancake.,,,,,,,,,,,,,,,,,,,,,,,vänder,"turns, rotates, pivots ",Jag vänder på boken.,I turn the book.,vände," turned, rotated, pivoted ",Han vände sig om.,He turned around.,vänd," turned, rotated, pivoted",De har vänd bladet.,They have turned the page.,298
Kelly List,A1,101 to 200,Verb,Att Veta,Det är viktigt att veta sanningen.,"know, understand, realize",It is important to know the truth.,,,,,,,,,,,,,,,,,,,,,,,vet,"know, understand, realize ",Jag vet svaret.,I know the answer.,visste," knew, understood, recognized ",Han visste ingenting.,He knew nothing.,vetat," known, learned, understood",Vi har vetat det länge.,We have known it for a long time.,299
Kelly List,A1,101 to 200,Verb,Att Visa,,"show, display, exhibit",,,,,,,,,,,,,,,,,,,,,,,,visar,"shows, displays, exhibits ",Han visar vägen.,He shows the way.,visade," showed, displayed, exhibited ",Hon visade bilden.,She showed the picture.,visat," shown, displayed, exhibited",De har visat filmen.,They have shown the movie.,300
Kelly List,A1,1101 to 1200,Verb,Att Anpassa,,"adapt, adjust, modify",,,,,,,,,,,,,,,,,,,,,,,,anpassar,"adapts, adjusts, modifies ",Jag anpassar min plan.,I adjust my plan.,anpassade," adapted, adjusted, modified ",Han anpassade stolen.,He adjusted the chair.,anpassat," adapted, adjusted, modified",Vi har anpassat oss.,We have adapted.,301
Kelly List,A1,1101 to 1200,Verb,Att Åstadkomma,,"achieve, accomplish, attain",,,,,,,,,,,,,,,,,,,,,,,,åstadkommer,"accomplishes, achieves, effects ",Han åstadkommer bra resultat.,He achieves good results.,åstadkom," accomplished, achieved, brought about ",Hon åstadkom mycket igår.,She achieved a lot yesterday.,åstadkommit," accomplished, achieved, realized",Vi har åstadkommit målet.,We have achieved the goal.,302
Kelly List,A1,1101 to 1200,Verb,Att Återkomma,,"return, recur, reappear",,,,,,,,,,,,,,,,,,,,,,,,återkommer,"returns, recurs, reappears ",Jag återkommer snart.,I will get back to you soon.,återkom," returned, recurred, reappeared ",Han återkom igår.,He returned yesterday.,återkommit," returned, recurred, reappeared",De har återkommit nu.,They have returned now.,303
Kelly List,A1,1101 to 1200,Verb,Att Återstå,Det verkar återstå mycket att göra.,"remain, stay, persist",There seems to be a lot left to do.,,,,,,,,,,,,,,,,,,,,,,,återstår,"remains, persists, lingers ",Bara lite tid återstår.,Only a little time remains.,återstod," remained, persisted, lingered ",Mycket arbete återstod.,Much work remained.,återstått," remained, persisted, lingered",Frågan har återstått obesvarad.,The question has remained unanswered.,304
Kelly List,A1,1101 to 1200,Verb,Att Avskaffa,,"abolish, repeal, eliminate",,,,,,,,,,,,,,,,,,,,,,,,avskaffar,"abolishes, eliminates, cancels ",De avskaffar skatten.,They abolish the tax.,avskaffade," abolished, eliminated, canceled ",Han avskaffade regeln.,He abolished the rule.,avskaffat," abolished, eliminated, canceled",Vi har avskaffat lagen.,We have abolished the law.,305
Kelly List,A1,1101 to 1200,Verb,Att Begränsa,,"limit, restrict, confine",,,,,,,,,,,,,,,,,,,,,,,,begränsar,"limits, restricts, confines ",Jag begränsar mitt sockerintag.,I limit my sugar intake.,begränsade," limited, restricted, confined ",Han begränsade sin tid vid datorn.,He limited his time at the computer.,begränsat," limited, restricted, circumscribed",Vi har begränsat antalet platser.,We have limited the number of seats.,306
Kelly List,A1,1101 to 1200,Verb,Att Bekämpa,,"combat, fight, tackle",,,,,,,,,,,,,,,,,,,,,,,,bekämpar,"combats, fights, opposes ",Vi bekämpar sjukdomen.,We are fighting the disease.,bekämpade," combated, fought, opposed ",Han bekämpade elden.,He fought the fire.,bekämpat," combated, fought, opposed",De har bekämpat brott.,They have fought crime.,307
Kelly List,A1,1101 to 1200,Verb,Att Bekräfta,,"confirm, verify, acknowledge",,,,,,,,,,,,,,,,,,,,,,,,bekräftar,"confirms, verifies, validates ",Jag bekräftar min bokning.,I confirm my booking.,bekräftade," confirmed, verified, validated ",Han bekräftade tiden.,He confirmed the time.,bekräftat," confirmed, verified, validated",Vi har bekräftat mailet.,We have confirmed the email.,308
Kelly List,A1,1101 to 1200,Verb,Att Beräkna,,"calculate, compute, estimate",,,,,,,,,,,,,,,,,,,,,,,,beräknar,"calculates, computes, estimates ",Jag beräknar priset.,I calculate the price.,beräknade," calculated, computed, estimated ",Han beräknade svaret.,He calculated the answer.,beräknat," calculated, computed, estimated",Vi har beräknat tiden.,We have calculated the time.,309
Kelly List,A1,1101 to 1200,Verb,Att Bereda,Vi måste bereda oss på det värsta.,"prepare, ready, arrange",We must prepare ourselves for the worst.,,,,,,,,,,,,,,,,,,,,,,,bereder,"prepares, processes, treats ",Han bereder maten.,He prepares the food.,beredde," prepared, processed, treated ",Hon beredde plats för oss.,She prepared space for us.,berett," prepared, processed, treated",Vi har berett vägen.,We have prepared the way.,310
Kelly List,A1,1101 to 1200,Verb,Att Beröra,Det är svårt att inte beröra det ämnet.,"touch, affect, concern",It is difficult not to touch on that subject.,,,,,,,,,,,,,,,,,,,,,,,berör,"touches, affects, concerns ",Musiken berör mig.,The music touches me.,berörde," touched, affected, concerned ",Filmen berörde mig.,The movie touched me.,berört," touched, affected, concerned",Det har berört oss alla.,It has touched us all.,311
Kelly List,A1,1101 to 1200,Verb,Att Beställa,,"order, book, purchase",,,,,,,,,,,,,,,,,,,,,,,,beställer,"orders, reserves, books ",Jag beställer kaffe.,I am ordering coffee.,beställde," ordered, reserved, booked ",Han beställde mat.,He ordered food.,beställt," ordered, reserved, booked",Vi har beställt tid.,We have booked an appointment.,312
Kelly List,A1,1101 to 1200,Verb,Att Betona,,"emphasize, stress, highlight",,,,,,,,,,,,,,,,,,,,,,,,betonar,"emphasizes, stresses, underlines ",Jag betonar ordet.,I emphasize the word.,betonade," emphasized, stressed, underlined ",Han betonade vikten av det.,He emphasized the importance of it.,betonat," emphasized, stressed, underlined",Vi har betonat detta.,We have emphasized this.,313
Kelly List,A1,1101 to 1200,Verb,Att Bevara,,"preserve, maintain, conserve",,,,,,,,,,,,,,,,,,,,,,,,bevarar,"preserves, maintains, protects ",Vi bevarar naturen.,We preserve nature.,bevarade," preserved, maintained, protected ",De bevarade huset.,They preserved the house.,bevarat," preserved, maintained, protected",Vi har bevarat maten.,We have preserved the food.,314
Kelly List,A1,1101 to 1200,Verb,Att Bevisa,,"prove, demonstrate, establish",,,,,,,,,,,,,,,,,,,,,,,,bevisar,"prove, demonstrate, verify ",Han bevisar sin teori.,He proves his theory.,bevisade," proved, demonstrated, verified ",Hon bevisade sin oskuld.,She proved her innocence.,bevisat," proven, demonstrated, verified",De har bevisat felet.,They have proven the error.,315
Kelly List,A1,1101 to 1200,Verb,Att Blanda,,"mix, blend, combine",,,,,,,,,,,,,,,,,,,,,,,,blandar,"mixes, blends, combines ",Jag blandar socker i kaffet.,I mix sugar in the coffee.,blandade," mixed, blended, combined ",Hon blandade färgerna.,She mixed the colors.,blandat," mixed, blended, combined",Vi har blandat saften.,We have mixed the juice.,316
Kelly List,A1,1101 to 1200,Verb,Att Definiera,,"define, specify, determine",,,,,,,,,,,,,,,,,,,,,,,,definierar,"defines, specifies, clarifies ",Jag definierar ordet.,I define the word.,definierade," defined, specified, clarified ",Hon definierade målet.,She defined the goal.,definierat," defined, specified, clarified",Vi har definierat termen.,We have defined the term.,317
Kelly List,A1,1101 to 1200,Verb,Att Erhålla,,"receive, obtain, acquire",,,,,,,,,,,,,,,,,,,,,,,,erhåller,"receives, gets, obtains ",Han erhåller ett paket.,He receives a package.,erhöll," received, got, obtained ",Vi erhöll svaret igår.,We received the answer yesterday.,erhållit," received, gotten, acquired",De har erhållit information.,They have received information.,318
Kelly List,A1,1101 to 1200,Verb,Att Fånga,,"catch, capture, seize",,,,,,,,,,,,,,,,,,,,,,,,fångar,"catches, captures, grabs ",Jag fångar bollen.,I catch the ball.,fångade," caught, captured, seized ",Han fångade en fisk.,He caught a fish.,fångat," caught, captured, trapped",Vi har fångat tjuven.,We have caught the thief.,319
Kelly List,A1,1101 to 1200,Verb,Att Finansiera,,"finance, fund, subsidize",,,,,,,,,,,,,,,,,,,,,,,,finansierar,"finances, funds, subsidizes ",Han finansierar sin bil.,He finances his car.,finansierade," financed, funded, subsidized ",De finansierade projektet.,They financed the project.,finansierat," financed, funded, subsidized",Vi har finansierat resan.,We have financed the trip.,320
Kelly List,A1,1101 to 1200,Verb,Att Fira,,"celebrate, commemorate, observe",,,,,,,,,,,,,,,,,,,,,,,,firar,"celebrates, observes, commemorates ",Vi firar min födelsedag.,We are celebrating my birthday.,firade," celebrated, observed, commemorated ",De firade jul hemma.,They celebrated Christmas at home.,firat," celebrated, observed, commemorated",Jag har firat klart nu.,I have finished celebrating now.,321
Kelly List,A1,1101 to 1200,Verb,Att Fixa,,"fix, repair, arrange",,,,,,,,,,,,,,,,,,,,,,,,fixar,"fixes, repairs, mends ",Han fixar kaffe.,He is making coffee.,fixade," fixed, repaired, mended ",Vi fixade bilen.,We fixed the car.,fixat," fixed, repaired, mended",De har fixat allt.,They have fixed everything.,322
Kelly List,A1,1101 to 1200,Verb,Att Fly,Det är svårt att fly från sitt samvete.,"flee, escape, run",It is difficult to flee from one's conscience.,,,,,,,,,,,,,,,,,,,,,,,flyr,"flees, escapes, runs away ",Fåglarna flyr söderut.,The birds fly south.,flydde," fled, escaped, ran away ",Han flydde från branden.,He fled from the fire.,flytt," fled, escaped, run away",De har flytt landet.,They have fled the country.,323
Kelly List,A1,1101 to 1200,Verb,Att Flyga,Det är roligt att flyga.,"fly, soar, glide",It is fun to fly.,,,,,,,,,,,,,,,,,,,,,,,flyger,"flies, soars, glides ",Fåglarna flyger söderut.,The birds fly south.,flög," flew, soared, glided ",Flygplanet flög till London.,The plane flew to London.,flugit," flown, soared, glided",Jag har aldrig flugit förut.,I have never flown before.,324
Kelly List,A1,1101 to 1200,Verb,Att Fokusera,,"focus, concentrate, center",,,,,,,,,,,,,,,,,,,,,,,,fokuserar,"focuses, concentrates, directs ",Jag fokuserar på skolan.,I focus on school.,fokuserade," focused, concentrated, centered ",Han fokuserade på läxan.,He focused on the homework.,fokuserat," focused, concentrated, aimed",De har fokuserat hela dagen.,They have focused all day.,325
Kelly List,A1,1101 to 1200,Verb,Att Förbereda,,"prepare, ready, arrange",,,,,,,,,,,,,,,,,,,,,,,,förbereder,"prepares, readies, arranges ",Jag förbereder maten.,I am preparing the food.,förberedde," prepared, readied, arranged ",Han förberedde festen.,He prepared the party.,förberett," prepared, readied, arranged",Vi har förberett allt.,We have prepared everything.,326
Kelly List,A1,1101 to 1200,Verb,Att Förbjuda,,"prohibit, forbid, ban",,,,,,,,,,,,,,,,,,,,,,,,förbjuder,"forbids, prohibits, bans ",De förbjuder rökning här.,They ban smoking here.,förbjöd," forbade, prohibited, banned ",Han förbjöd dem att gå.,He forbade them to go.,förbjudit," forbidden, prohibited, banned",Vi har förbjudit mobiler.,We have banned mobile phones.,327
Kelly List,A1,1101 to 1200,Verb,Att Förbli,Det är viktigt att förbli lugn.,"remain, stay, continue",It is important to remain calm.,,,,,,,,,,,,,,,,,,,,,,,förblir,"remains, stays, continues ",Vi förblir vänner.,We remain friends.,förblev," remained, stayed, endured ",Han förblev lugn.,He remained calm.,förblivit," remained, stayed, persisted",De har förblivit här.,They have remained here.,328
Kelly List,A1,1101 to 1200,Verb,Att Föreligga,Det kan föreligga vissa risker med projektet.,"exist, be, prevail",There may be certain risks with the project.,,,,,,,,,,,,,,,,,,,,,,,föreligger,"exists, prevails, occurs ",Det föreligger en risk.,There is a risk.,förelåg," existed, prevailed, occurred ",En risk förelåg då.,A risk existed then.,förelat," existed, prevailed, occurred",Det har förelat problem.,Problems have existed.,329
Kelly List,A1,1101 to 1200,Verb,Att Förhindra,,"prevent, hinder, stop",,,,,,,,,,,,,,,,,,,,,,,,förhindrar,"prevents, stops, blocks ",Regnet förhindrar vår lek.,The rain prevents our play.,förhindrade," prevented, stopped, blocked ",Han förhindrade en olycka.,He prevented an accident.,förhindrat," prevented, stopped, blocked",De har förhindrat felet.,They have prevented the error.,330
Kelly List,A1,1101 to 1200,Verb,Att Forma,,"shape, mold, fashion",,,,,,,,,,,,,,,,,,,,,,,,formar,"shapes, molds, fashions ",Han formar leran.,He shapes the clay.,formade," shaped, molded, fashioned ",Hon formade en vas.,She shaped a vase.,format," shaped, molded, fashioned",De har format degen.,They have shaped the dough.,331
Kelly List,A1,1101 to 1200,Verb,Att Förstärka,,"reinforce, strengthen, fortify",,,,,,,,,,,,,,,,,,,,,,,,förstärker,"reinforces, strengthens, bolsters ",De förstärker muren nu.,They are reinforcing the wall now.,förstärkte," reinforced, strengthened, bolstered ",Han förstärkte laget igår.,He reinforced the team yesterday.,förstärkt," reinforced, strengthened, bolstered",Vi har förstärkt dörren.,We have reinforced the door.,332
Kelly List,A1,1101 to 1200,Verb,Att Förutsätta,,"presuppose, assume, presume",,,,,,,,,,,,,,,,,,,,,,,,förutsätter,"presupposes, assumes, requires ",Jag förutsätter att du kommer.,I assume that you are coming.,förutsatte," presupposed, assumed, required ",Vi förutsatte att det var sant.,We assumed that it was true.,förutsatt," presupposed, assumed, required",De har förutsatt att allt är klart.,They have assumed that everything is ready.,333
Kelly List,A1,1101 to 1200,Verb,Att Framföra,Han ska framföra en sång.,"present, deliver, perform",He is going to perform a song.,,,,,,,,,,,,,,,,,,,,,,,framför,"present, deliver, perform ",Han framför ett tack.,He delivers a thank you.,framförde," presented, delivered, performed ",Hon framförde en sång.,She performed a song.,framfört," presented, delivered, performed",De har framfört förslaget.,They have presented the proposal.,334
Kelly List,A1,1101 to 1200,Verb,Att Framhålla,,"highlight, emphasize, stress",,,,,,,,,,,,,,,,,,,,,,,,framhåller,"emphasizes, stresses, highlights ",Han framhåller vikten av sömn.,He emphasizes the importance of sleep.,framhöll," emphasized, stressed, highlighted ",Hon framhöll att det var viktigt.,She emphasized that it was important.,framhållit," emphasized, stressed, highlighted",Vi har framhållit problemet tidigare.,We have emphasized the problem before.,335
Kelly List,A1,1101 to 1200,Verb,Att Främja,,"promote, further, encourage",,,,,,,,,,,,,,,,,,,,,,,,främjar,"promotes, encourages, advances ",Han främjar god hälsa.,He promotes good health.,främjade," promoted, encouraged, advanced ",De främjade samarbetet.,They promoted the cooperation.,främjat," promoted, encouraged, advanced",Vi har främjat fred.,We have promoted peace.,336
Kelly List,A1,1101 to 1200,Verb,Att Framstå,Det är viktigt att framstå som professionell under en intervju.,"appear, seem, look",It is important to appear professional during an interview.,,,,,,,,,,,,,,,,,,,,,,,framstår,"appears, seems, looks ",Han framstår som glad.,He appears happy.,framstod," appeared, seemed, looked ",Han framstod som trött.,He appeared tired.,framstått," appeared, seemed, looked",Han har framstått som lugn.,He has appeared calm.,337
Kelly List,A1,1101 to 1200,Verb,Att Framställa,,"produce, manufacture, create",,,,,,,,,,,,,,,,,,,,,,,,framställer,"produces, manufactures, creates ",De framställer bilar.,They produce cars.,framställde," produced, manufactured, created ",Han framställde en plan.,He presented a plan.,framställt," produced, manufactured, created",Vi har framställt filmen.,We have produced the film.,338
Kelly List,A1,1101 to 1200,Verb,Att Garantera,,"guarantee, ensure, warrant",,,,,,,,,,,,,,,,,,,,,,,,garanterar,"guarantees, ensures, assures ",Jag garanterar dig framgång.,I guarantee you success.,garanterade," guaranteed, ensured, assured ",Företaget garanterade produkten.,The company guaranteed the product.,garanterat," guaranteed, pledged, promised",De har garanterat säkerheten.,They have guaranteed the safety.,339
Kelly List,A1,1101 to 1200,Verb,Att Gifta,,"marry, wed, unite",,,,,,,,,,,,,,,,,,,,,,,,gifter sig,"marries, weds, joins ",De gifter sig i dag.,They are getting married today.,gifte sig," married, wed, united ",De gifte sig förra året.,They got married last year.,gift sig," married, wedded, joined",De har gift sig nyligen.,They have married recently.,340
Kelly List,A1,1101 to 1200,Verb,Att Godkänna,,"approve, ratify, authorize",,,,,,,,,,,,,,,,,,,,,,,,godkänner,"approves, accepts, authorizes ",Han godkänner planen.,He approves the plan.,godkände," approved, accepted, authorized ",Hon godkände mitt svar.,She approved my answer.,godkänt," approved, accepted, authorized",De har godkänt förslaget.,They have approved the proposal.,341
Kelly List,A1,1101 to 1200,Verb,Att Granska,Det är viktigt att granska källorna noggrant.,"examine, inspect, scrutinize",It is important to examine the sources carefully.,,,,,,,,,,,,,,,,,,,,,,,granskar,"examines, inspects, reviews ",Jag granskar listan.,I am examining the list.,granskade," examined, inspected, reviewed ",Han granskade bilen.,He inspected the car.,granskat," examined, inspected, reviewed",Vi har granskat svaren.,We have reviewed the answers.,342
Kelly List,A1,1101 to 1200,Verb,Att Gripa,,"seize, grasp, grab",,,,,,,,,,,,,,,,,,,,,,,,griper,"grips, grasps, seizes ",Polisen griper tjuven.,The police arrest the thief.,grep," gripped, grasped, seized ",Polisen grep tjuven.,The police arrested the thief.,gripit," gripped, grasped, seized",Polisen har gripit tjuven.,The police have arrested the thief.,343
Kelly List,A1,1101 to 1200,Verb,Att Gynna,,"favor, benefit, promote",,,,,,,,,,,,,,,,,,,,,,,,gynnar,"favors, benefits, promotes ",Det gynnar dig.,It benefits you.,gynnade," favored, benefited, promoted ",Det gynnade alla.,It benefited everyone.,gynnat," favored, benefited, promoted",Det har gynnat oss.,It has benefited us.,344
Kelly List,A1,1101 to 1200,Verb,Att Hänvisa,,"refer, direct, consult",,,,,,,,,,,,,,,,,,,,,,,,hänvisar,"refers, directs, cites ",Han hänvisar till dig.,He refers to you.,hänvisade," referred, directed, cited ",Hon hänvisade till oss.,She referred to us.,hänvisat," referred, directed, cited",Vi har hänvisat kunden.,We have referred the customer.,345
Kelly List,A1,1101 to 1200,Verb,Att Inträffa,Något oväntat kan inträffa när som helst.,"occur, happen, take place",Something unexpected can happen at any time.,,,,,,,,,,,,,,,,,,,,,,,inträffar,"occurs, happens, transpires ",Det inträffar ofta olyckor här.,Accidents often occur here.,inträffade," occurred, happened, transpired ",Olyckan inträffade igår.,The accident occurred yesterday.,inträffat," occurred, happened, transpired",Vad har inträffat?,What has happened?,346
Kelly List,A1,1101 to 1200,Verb,Att Klaga,,"complain, grumble, gripe",,,,,,,,,,,,,,,,,,,,,,,,klagar,"complains, grumbles, whines ",Jag klagar inte.,I am not complaining.,klagade," complained, grumbled, whined ",Han klagade på maten.,He complained about the food.,klagat," complained, grumbled, whined",Vi har klagat ofta.,We have complained often.,347
Kelly List,A1,1101 to 1200,Verb,Att Koppla,,"connect, link, join",,,,,,,,,,,,,,,,,,,,,,,,kopplar,"connects, links, joins ",Jag kopplar in min skärm.,I connect my screen.,kopplade," connected, linked, joined ",Han kopplade ihop datorerna.,He connected the computers.,kopplat," connected, linked, joined",De har kopplat ur teven.,They have disconnected the TV.,348
Kelly List,A1,1101 to 1200,Verb,Att Ladda,,"load, charge, refill",,,,,,,,,,,,,,,,,,,,,,,,laddar,"loads, fills, powers ",Jag laddar mobilen.,I am charging the mobile.,laddade," loaded, filled, powered ",Han laddade batteriet.,He charged the battery.,laddat," loaded, filled, powered",Vi har laddat bilen.,We have charged the car.,349
Kelly List,A1,1101 to 1200,Verb,Att Laga,Jag gillar att laga mat.,"repair, fix, mend",I like to cook food.,,,,,,,,,,,,,,,,,,,,,,,lagar,"cooks, prepares, fixes ",Jag lagar mat nu.,I am cooking food now.,lagade," cooked, prepared, fixed ",Han lagade mat igår.,He cooked food yesterday.,lagat," cooked, prepared, fixed",Vi har lagat maten.,We have cooked the food.,350
Kelly List,A1,1101 to 1200,Verb,Att Låna,,"borrow, lend, loan",,,,,,,,,,,,,,,,,,,,,,,,lånar,"borrows, lends, loans ",Jag lånar en bok.,I am borrowing a book.,lånade," borrowed, lent, loaned ",Han lånade min penna.,He borrowed my pen.,lånat," borrowed, lent, loaned",Vi har lånat pengar.,We have borrowed money.,351
Kelly List,A1,1101 to 1200,Verb,Att Lätta,,"lighten, alleviate, ease",,,,,,,,,,,,,,,,,,,,,,,,lättar,"eases, lightens, alleviates ",Han lättar på trycket.,He eases the pressure.,lättade," eased, lightened, relieved ",Dimman lättade under morgonen.,The fog lifted during the morning.,lättat," eased, lightened, relieved",Det har lättat nu.,It has eased now.,352
Kelly List,A1,1101 to 1200,Verb,Att Leka,Barnen gillar att leka i parken.,"play, frolic, romp",The children like to play in the park.,,,,,,,,,,,,,,,,,,,,,,,leker,"plays, frolics, romps ",Barnen leker i parken.,The children are playing in the park.,lekte," played, frolicked, romped ",Vi lekte hela dagen.,We played all day.,lekt," played, frolicked, romped",Han har lekt med bollen.,He has played with the ball.,353
Kelly List,A1,1101 to 1200,Verb,Att Leverera,,"deliver, supply, provide",,,,,,,,,,,,,,,,,,,,,,,,levererar,"delivers, supplies, provides ",De levererar mat hem.,They deliver food home.,levererade," delivered, supplied, provided ",Han levererade paketet igår.,He delivered the package yesterday.,levererat," delivered, supplied, provided",Vi har levererat varorna.,We have delivered the goods.,354
Kelly List,A1,1101 to 1200,Verb,Att Likna,Det är svårt att inte likna sin pappa.,"resemble, mirror, match",It is difficult not to resemble one's father.,,,,,,,,,,,,,,,,,,,,,,,liknar,"resembles, looks like, mirrors ",Han liknar sin pappa.,He resembles his father.,liknade," resembled, looked like, mirrored ",De liknade varandra.,They resembled each other.,liknat," resembled, looked like, mirrored",Hon har alltid liknat sin mor.,She has always resembled her mother.,355
Kelly List,A1,1101 to 1200,Verb,Att Lita,,"trust, rely, count",,,,,,,,,,,,,,,,,,,,,,,,litar,"trusts, relies, depends ",Jag litar på dig.,I trust you.,litade," trusted, relied, depended ",Hon litade på honom.,She trusted him.,litat," trusted, relied, depended",Vi har alltid litat på dem.,We have always trusted them.,356
Kelly List,A1,1101 to 1200,Verb,Att Logga,,"log, register, record",,,,,,,,,,,,,,,,,,,,,,,,loggar,"logs, records, registers ",Jag loggar in nu.,I am logging in now.,loggade," logged, recorded, registered ",Han loggade in igår.,He logged in yesterday.,loggat," logged, recorded, registered",Vi har loggat in.,We have logged in.,357
Kelly List,A1,1101 to 1200,Verb,Att Mäta,,"measure, calculate, gauge",,,,,,,,,,,,,,,,,,,,,,,,mäter,"measure, calculate, gauge ",Han mäter bordet.,He measures the table.,mätte," measured, calculated, gauged ",Hon mätte rummet.,She measured the room.,mätt," measured, calculated, gauged",Vi har mätt allt.,We have measured everything.,358
Kelly List,A1,1101 to 1200,Verb,Att Medverka,,"participate, contribute, collaborate",,,,,,,,,,,,,,,,,,,,,,,,medverkar,"participates, contributes, collaborates ",Han medverkar i filmen.,He is participating in the movie.,medverkade," participated, contributed, collaborated ",Hon medverkade i mötet.,She participated in the meeting.,medverkat," participated, contributed, collaborated",De har medverkat förut.,They have participated before.,359
Kelly List,A1,1101 to 1200,Verb,Att Misslyckas,,"fail, flop, bomb",,,,,,,,,,,,,,,,,,,,,,,,misslyckas,"fail, flop, bomb ",Han misslyckas ofta.,He often fails.,misslyckades," failed, flopped, bombed ",Han misslyckades med provet.,He failed the exam.,misslyckats," failed, flopped, bombed",De har misslyckats igen.,They have failed again.,360
Kelly List,A1,1101 to 1200,Verb,Att Misstänka,,"suspect, distrust, doubt",,,,,,,,,,,,,,,,,,,,,,,,misstänker,"suspect, distrust, doubt ",Jag misstänker ingenting.,I suspect nothing.,misstänkte," suspected, distrusted, doubted ",Han misstänkte henne.,He suspected her.,misstänkt," suspected, distrusted, doubted",Vi har misstänkt det.,We have suspected it.,361
